{
  "schemaVersion": "1.0",
  "runId": "SJ-RUN-2041-8E13F641",
  "taskId": "SJ-EVAL-0010",
  "arm": "evidence_first_skill",
  "repetition": 2,
  "model": {
    "provider": "OpenAI",
    "model": "gpt-5.6-terra",
    "agent": "codex-cli",
    "agentVersion": "0.144.5",
    "effort": "medium"
  },
  "controls": {
    "promptSha256": "7f7c09b15869d55bc40e116ebc79090f492c78b0ce3953e7da4d3e681ee08e5e",
    "repositoryCommit": "b9e61265f8394a6c5d0358e89e037873375b017a",
    "networkAccess": false,
    "maxTurns": 1,
    "timeoutSeconds": 300,
    "pluginManifestSha256": "66b3787a4252d399e92f9de63d0ab62e83d8631d14ca1c18ab80c074144deb93",
    "skillSha256": "53c9d462120bc08d3351d6a24edd4bb8292f9db21409b6a4c5c7b591597d9418"
  },
  "status": "completed",
  "answer": {
    "schemaVersion": "1.0",
    "taskId": "SJ-EVAL-0010",
    "answer": "The helper is the default-exported connectToKiota function. It spawns Kiota with the \"rpc\" argument; callback failures become an Error, and finally ends the child stdin then kills the child process.",
    "claims": [
      {
        "key": "function_name",
        "value": "connectToKiota (default export)",
        "evidence": [
          {
            "path": "vscode/packages/npm-package/lib/connect.ts",
            "startLine": 6,
            "endLine": 6
          }
        ]
      },
      {
        "key": "child_argument",
        "value": "[\"rpc\"]",
        "evidence": [
          {
            "path": "vscode/packages/npm-package/lib/connect.ts",
            "startLine": 9,
            "endLine": 9
          }
        ]
      },
      {
        "key": "callback_error_result",
        "value": "Returns new Error(error.data.message) when available; otherwise returns new Error(\"An unknown error occurred\").",
        "evidence": [
          {
            "path": "vscode/packages/npm-package/lib/connect.ts",
            "startLine": 21,
            "endLine": 27
          }
        ]
      },
      {
        "key": "child_cleanup",
        "value": "In finally, ends childProcess.stdin (when present) and calls childProcess.kill().",
        "evidence": [
          {
            "path": "vscode/packages/npm-package/lib/connect.ts",
            "startLine": 28,
            "endLine": 35
          }
        ]
      }
    ],
    "unknowns": [],
    "confidence": 1
  },
  "scores": {
    "strictSuccess": false,
    "claimPrecision": 0.75,
    "claimRecall": 0.75,
    "claimF1": 0.75,
    "citationValidity": 1,
    "criticalForbiddenClaims": 0,
    "scorerVersion": "1.1.0"
  },
  "metrics": {
    "turns": 1,
    "toolCalls": 3,
    "nativeToolCalls": 3,
    "sanjayaToolCalls": 0,
    "repositorySourceBytesRead": 9408,
    "toolResponseBytes": 9408,
    "uncachedInputTokens": 7393,
    "cachedInputTokens": 44032,
    "outputTokens": 905,
    "wallTimeMs": 25492,
    "indexWrites": 0
  },
  "trace": {
    "path": "traces/SJ-RUN-2041-8E13F641.jsonl",
    "sha256": "c8561a45fc0e0646631cac12fa79b9672ecfb2f8093aec3617cad5b45bb85197",
    "eventCount": 7
  }
}
