{
  "schemaVersion": "1.0",
  "runId": "SJ-RUN-0007-1A157E94",
  "taskId": "SJ-EVAL-0011",
  "arm": "sanjaya_available",
  "repetition": 1,
  "model": {
    "provider": "OpenAI",
    "model": "gpt-5.6-terra",
    "agent": "codex-cli",
    "agentVersion": "0.144.5",
    "effort": "medium"
  },
  "controls": {
    "promptSha256": "b87c9be43b79a79a0295b1af87ddc3d51f7262019e017bc81699241fa897d547",
    "repositoryCommit": "327570c17f4e337ea5ae4574a5fe6abee4a6838b",
    "networkAccess": false,
    "maxTurns": 1,
    "timeoutSeconds": 300
  },
  "status": "completed",
  "answer": {
    "schemaVersion": "1.0",
    "taskId": "SJ-EVAL-0011",
    "answer": "Cancellation after the detached child starts is caught in `LaunchAndWaitForBackchannelAsync`, which invokes `RequestGracefulShutdownThenForceKillAsync`. The shutdown call is deliberately given `CancellationToken.None`, not the caller's cancelled token.",
    "claims": [
      {
        "key": "containing_method",
        "value": "`LaunchAndWaitForBackchannelAsync` in `src/Aspire.Cli/Commands/AppHostLauncher.cs`; its `OperationCanceledException` handler invokes the cleanup after the child-start path.",
        "evidence": [
          {
            "path": "src/Aspire.Cli/Commands/AppHostLauncher.cs",
            "startLine": 372,
            "endLine": 400
          },
          {
            "path": "src/Aspire.Cli/Commands/AppHostLauncher.cs",
            "startLine": 549,
            "endLine": 552
          }
        ]
      },
      {
        "key": "cleanup_helper",
        "value": "`RequestGracefulShutdownThenForceKillAsync(IProcessExecution childProcess, DateTimeOffset? childStartedAt)`.",
        "evidence": [
          {
            "path": "src/Aspire.Cli/Commands/AppHostLauncher.cs",
            "startLine": 549,
            "endLine": 558
          },
          {
            "path": "src/Aspire.Cli/Commands/AppHostLauncher.cs",
            "startLine": 578,
            "endLine": 585
          }
        ]
      },
      {
        "key": "shutdown_token",
        "value": "No. `RequestGracefulShutdownThenForceKillAsync` passes `CancellationToken.None` to `processShutdownService.StopProcessTreeAsync`, rather than the caller's cancelled token.",
        "evidence": [
          {
            "path": "src/Aspire.Cli/Commands/AppHostLauncher.cs",
            "startLine": 578,
            "endLine": 585
          }
        ]
      }
    ],
    "unknowns": [],
    "confidence": 0.99
  },
  "scores": {
    "strictSuccess": false,
    "claimPrecision": 0,
    "claimRecall": 0,
    "claimF1": 0,
    "citationValidity": 0.6,
    "criticalForbiddenClaims": 0,
    "scorerVersion": "1.0.0"
  },
  "metrics": {
    "turns": 1,
    "toolCalls": 3,
    "nativeToolCalls": 3,
    "sanjayaToolCalls": 0,
    "repositorySourceBytesRead": 568633,
    "toolResponseBytes": 568633,
    "uncachedInputTokens": 29392,
    "cachedInputTokens": 82432,
    "outputTokens": 876,
    "wallTimeMs": 25218
  },
  "trace": {
    "path": "traces/SJ-RUN-0007-1A157E94.jsonl",
    "sha256": "e92eed1623379eb0bd3f91b036202d4b5df1a6943acee37bb638f095f94c2d1a",
    "eventCount": 6
  }
}
