{
  "schemaVersion": "1.0",
  "runId": "SJ-RUN-2023-4D5B16D0",
  "taskId": "SJ-EVAL-0007",
  "arm": "native",
  "repetition": 1,
  "model": {
    "provider": "OpenAI",
    "model": "gpt-5.6-terra",
    "agent": "codex-cli",
    "agentVersion": "0.144.5",
    "effort": "medium"
  },
  "controls": {
    "promptSha256": "9dedf3dd0c14c78ed13866b6b8c2c60eaa9b4ef25623c50e7cc973e9847f4cff",
    "repositoryCommit": "d8b040c63aaffad22aa9921536ae201cff53cc0f",
    "networkAccess": false,
    "maxTurns": 1,
    "timeoutSeconds": 300
  },
  "status": "completed",
  "answer": {
    "schemaVersion": "1.0",
    "taskId": "SJ-EVAL-0007",
    "answer": "The worker-wide VM-pool V8 cache is `CodeCache`. A hit is validated by the module identifier and exact source text. If cache production throws, it stores an entry with that source and `data: undefined`.",
    "claims": [
      {
        "key": "cache_class",
        "value": "`CodeCache`, instantiated once at worker scope for VM tests.",
        "evidence": [
          {
            "path": "packages/vitest/src/runtime/vm/code-cache.ts",
            "startLine": 7,
            "endLine": 18
          },
          {
            "path": "packages/vitest/src/runtime/workers/vm.ts",
            "startLine": 24,
            "endLine": 26
          }
        ]
      },
      {
        "key": "hit_guard",
        "value": "The module identifier selects the entry, and its `source` must exactly equal the requested source.",
        "evidence": [
          {
            "path": "packages/vitest/src/runtime/vm/code-cache.ts",
            "startLine": 14,
            "endLine": 16
          },
          {
            "path": "packages/vitest/src/runtime/vm/code-cache.ts",
            "startLine": 21,
            "endLine": 26
          }
        ]
      },
      {
        "key": "produce_failure",
        "value": "An empty cache entry is stored: `{ source, data: undefined }`.",
        "evidence": [
          {
            "path": "packages/vitest/src/runtime/vm/code-cache.ts",
            "startLine": 29,
            "endLine": 32
          },
          {
            "path": "packages/vitest/src/runtime/vm/code-cache.ts",
            "startLine": 39,
            "endLine": 46
          }
        ]
      }
    ],
    "unknowns": [],
    "confidence": 1
  },
  "scores": {
    "strictSuccess": false,
    "claimPrecision": 0.3333333333333333,
    "claimRecall": 0.3333333333333333,
    "claimF1": 0.3333333333333333,
    "citationValidity": 0.8333333333333334,
    "criticalForbiddenClaims": 0,
    "scorerVersion": "1.1.0"
  },
  "metrics": {
    "turns": 1,
    "toolCalls": 2,
    "nativeToolCalls": 2,
    "sanjayaToolCalls": 0,
    "repositorySourceBytesRead": 26403,
    "toolResponseBytes": 26403,
    "uncachedInputTokens": 11469,
    "cachedInputTokens": 35072,
    "outputTokens": 748,
    "wallTimeMs": 20317,
    "indexWrites": 0
  },
  "trace": {
    "path": "traces/SJ-RUN-2023-4D5B16D0.jsonl",
    "sha256": "e84572bf2e8340ad52e3faf6b8db93df477477968c6535102de18bf9ef72a0b1",
    "eventCount": 5
  }
}
