{
  "schemaVersion": "1.0",
  "runId": "SJ-RUN-0022-3FAF83C0",
  "taskId": "SJ-EVAL-0007",
  "arm": "sanjaya_available",
  "repetition": 1,
  "model": {
    "provider": "OpenAI",
    "model": "gpt-5.6-terra",
    "agent": "codex-cli",
    "agentVersion": "0.144.5",
    "effort": "medium"
  },
  "controls": {
    "promptSha256": "9dedf3dd0c14c78ed13866b6b8c2c60eaa9b4ef25623c50e7cc973e9847f4cff",
    "repositoryCommit": "d8b040c63aaffad22aa9921536ae201cff53cc0f",
    "networkAccess": false,
    "maxTurns": 1,
    "timeoutSeconds": 300
  },
  "status": "completed",
  "answer": {
    "schemaVersion": "1.0",
    "taskId": "SJ-EVAL-0007",
    "answer": "The worker-wide VM-pool V8 code cache is CodeCache. A cache hit uses the module identifier and exact source text; a production failure stores an entry with that source and data: undefined.",
    "claims": [
      {
        "key": "cache_class",
        "value": "CodeCache",
        "evidence": [
          {
            "path": "packages/vitest/src/runtime/vm/code-cache.ts",
            "startLine": 7,
            "endLine": 19
          },
          {
            "path": "packages/vitest/src/runtime/workers/vm.ts",
            "startLine": 24,
            "endLine": 27
          }
        ]
      },
      {
        "key": "hit_guard",
        "value": "The module identifier locates the entry, and the entry's source must exactly equal the supplied source text.",
        "evidence": [
          {
            "path": "packages/vitest/src/runtime/vm/code-cache.ts",
            "startLine": 21,
            "endLine": 26
          }
        ]
      },
      {
        "key": "produce_failure",
        "value": "An entry is stored as { source, data: undefined }.",
        "evidence": [
          {
            "path": "packages/vitest/src/runtime/vm/code-cache.ts",
            "startLine": 39,
            "endLine": 46
          }
        ]
      }
    ],
    "unknowns": [],
    "confidence": 0.99
  },
  "scores": {
    "strictSuccess": false,
    "claimPrecision": 0.3333333333333333,
    "claimRecall": 0.3333333333333333,
    "claimF1": 0.3333333333333333,
    "citationValidity": 0.75,
    "criticalForbiddenClaims": 0,
    "scorerVersion": "1.0.0"
  },
  "metrics": {
    "turns": 1,
    "toolCalls": 2,
    "nativeToolCalls": 2,
    "sanjayaToolCalls": 0,
    "repositorySourceBytesRead": 13666,
    "toolResponseBytes": 13666,
    "uncachedInputTokens": 11228,
    "cachedInputTokens": 25344,
    "outputTokens": 604,
    "wallTimeMs": 24201
  },
  "trace": {
    "path": "traces/SJ-RUN-0022-3FAF83C0.jsonl",
    "sha256": "7707c2dbf13f26c8a20e493069c3befb2630081eec56b27efad63ddd3d7b3744",
    "eventCount": 5
  }
}
