{
  "schemaVersion": "1.0",
  "runId": "SJ-RUN-2020-442C6607",
  "taskId": "SJ-EVAL-0010",
  "arm": "native",
  "repetition": 2,
  "model": {
    "provider": "OpenAI",
    "model": "gpt-5.6-terra",
    "agent": "codex-cli",
    "agentVersion": "0.144.5",
    "effort": "medium"
  },
  "controls": {
    "promptSha256": "7f7c09b15869d55bc40e116ebc79090f492c78b0ce3953e7da4d3e681ee08e5e",
    "repositoryCommit": "b9e61265f8394a6c5d0358e89e037873375b017a",
    "networkAccess": false,
    "maxTurns": 1,
    "timeoutSeconds": 300
  },
  "status": "completed",
  "answer": {
    "schemaVersion": "1.0",
    "taskId": "SJ-EVAL-0010",
    "answer": "The npm-package helper is the default-exported `connectToKiota`; it spawns Kiota with `\"rpc\"`, returns an `Error` derived from `error.data.message` (or a fallback) if its callback throws, then ends the child stdin and kills the child in `finally`.",
    "claims": [
      {
        "key": "function_name",
        "value": "`connectToKiota` (default-exported async function).",
        "evidence": [
          {
            "path": "vscode/packages/npm-package/lib/connect.ts",
            "startLine": 6,
            "endLine": 6
          }
        ]
      },
      {
        "key": "child_argument",
        "value": "The child process is spawned with the argument array `[\"rpc\"]`.",
        "evidence": [
          {
            "path": "vscode/packages/npm-package/lib/connect.ts",
            "startLine": 9,
            "endLine": 9
          }
        ]
      },
      {
        "key": "callback_error_result",
        "value": "It returns `new Error(errorMessage)`, where `errorMessage` is `error.data.message` when available, otherwise `'An unknown error occurred'`.",
        "evidence": [
          {
            "path": "vscode/packages/npm-package/lib/connect.ts",
            "startLine": 23,
            "endLine": 27
          }
        ]
      },
      {
        "key": "child_cleanup",
        "value": "In `finally`, it ends `childProcess.stdin` and calls `childProcess.kill()` (after disposing the RPC reader, writer, and connection).",
        "evidence": [
          {
            "path": "vscode/packages/npm-package/lib/connect.ts",
            "startLine": 28,
            "endLine": 34
          }
        ]
      }
    ],
    "unknowns": [],
    "confidence": 0.99
  },
  "scores": {
    "strictSuccess": false,
    "claimPrecision": 0.75,
    "claimRecall": 0.75,
    "claimF1": 0.75,
    "citationValidity": 1,
    "criticalForbiddenClaims": 0,
    "scorerVersion": "1.1.0"
  },
  "metrics": {
    "turns": 1,
    "toolCalls": 2,
    "nativeToolCalls": 2,
    "sanjayaToolCalls": 0,
    "repositorySourceBytesRead": 6836,
    "toolResponseBytes": 6836,
    "uncachedInputTokens": 6170,
    "cachedInputTokens": 28928,
    "outputTokens": 665,
    "wallTimeMs": 19397,
    "indexWrites": 0
  },
  "trace": {
    "path": "traces/SJ-RUN-2020-442C6607.jsonl",
    "sha256": "068e328e1c038718688e5666332b0b756af3bf26960199b469aef1c0bd4b1c08",
    "eventCount": 5
  }
}
