{
  "schemaVersion": "1.0",
  "runId": "SJ-RUN-0044-81F176F3",
  "taskId": "SJ-EVAL-0009",
  "arm": "native",
  "repetition": 3,
  "model": {
    "provider": "OpenAI",
    "model": "gpt-5.6-terra",
    "agent": "codex-cli",
    "agentVersion": "0.144.5",
    "effort": "medium"
  },
  "controls": {
    "promptSha256": "d7b08725f97e30201f76be4003a8594ba5b9528ad102d583612d4ad967856ec4",
    "repositoryCommit": "b9e61265f8394a6c5d0358e89e037873375b017a",
    "networkAccess": false,
    "maxTurns": 1,
    "timeoutSeconds": 300
  },
  "status": "completed",
  "answer": {
    "schemaVersion": "1.0",
    "taskId": "SJ-EVAL-0009",
    "answer": "The TypeScript writer is Kiota.Builder.Writers.TypeScript.CodeMethodWriter. When a method's parent is a CodeClass, WriteCodeElement writes its documentation and prototype, then throws InvalidOperationException because TypeScript method implementations are not generated.",
    "claims": [
      {
        "key": "writer_type",
        "value": "Kiota.Builder.Writers.TypeScript.CodeMethodWriter",
        "evidence": [
          {
            "path": "src/Kiota.Builder/Writers/TypeScript/CodeMethodWriter.cs",
            "startLine": 9,
            "endLine": 13
          }
        ]
      },
      {
        "key": "class_parent_behavior",
        "value": "After writing the method documentation and prototype, it throws InvalidOperationException(\"No method implementations are generated in typescript: either functions or constants.\") when codeElement.Parent is CodeClass.",
        "evidence": [
          {
            "path": "src/Kiota.Builder/Writers/TypeScript/CodeMethodWriter.cs",
            "startLine": 20,
            "endLine": 26
          }
        ]
      }
    ],
    "unknowns": [],
    "confidence": 0.99
  },
  "scores": {
    "strictSuccess": false,
    "claimPrecision": 0.5,
    "claimRecall": 0.5,
    "claimF1": 0.5,
    "citationValidity": 1,
    "criticalForbiddenClaims": 0,
    "scorerVersion": "1.0.0"
  },
  "metrics": {
    "turns": 1,
    "toolCalls": 2,
    "nativeToolCalls": 2,
    "sanjayaToolCalls": 0,
    "repositorySourceBytesRead": 251916,
    "toolResponseBytes": 251916,
    "uncachedInputTokens": 14501,
    "cachedInputTokens": 40704,
    "outputTokens": 691,
    "wallTimeMs": 20325
  },
  "trace": {
    "path": "traces/SJ-RUN-0044-81F176F3.jsonl",
    "sha256": "28a0fbba01cfaddc9214b8605ed6f17951e342cd9e293d5f521899b2263cd2bf",
    "eventCount": 5
  }
}
