{
  "schemaVersion": "1.0",
  "runId": "SJ-RUN-2058-D612AEB3",
  "taskId": "SJ-EVAL-0009",
  "arm": "native",
  "repetition": 2,
  "model": {
    "provider": "OpenAI",
    "model": "gpt-5.6-terra",
    "agent": "codex-cli",
    "agentVersion": "0.144.5",
    "effort": "medium"
  },
  "controls": {
    "promptSha256": "d7b08725f97e30201f76be4003a8594ba5b9528ad102d583612d4ad967856ec4",
    "repositoryCommit": "b9e61265f8394a6c5d0358e89e037873375b017a",
    "networkAccess": false,
    "maxTurns": 1,
    "timeoutSeconds": 300
  },
  "status": "completed",
  "answer": {
    "schemaVersion": "1.0",
    "taskId": "SJ-EVAL-0009",
    "answer": "The TypeScript writer is Kiota.Builder.Writers.TypeScript.CodeMethodWriter. When a method’s parent is a CodeClass, WriteCodeElement writes its documentation and prototype, then throws InvalidOperationException because TypeScript method implementations are not generated.",
    "claims": [
      {
        "key": "writer_type",
        "value": "Kiota.Builder.Writers.TypeScript.CodeMethodWriter",
        "evidence": [
          {
            "path": "src/Kiota.Builder/Writers/TypeScript/CodeMethodWriter.cs",
            "startLine": 9,
            "endLine": 13
          }
        ]
      },
      {
        "key": "class_parent_behavior",
        "value": "It writes the method documentation and prototype, then throws InvalidOperationException(\"No method implementations are generated in typescript: either functions or constants.\") when codeElement.Parent is CodeClass.",
        "evidence": [
          {
            "path": "src/Kiota.Builder/Writers/TypeScript/CodeMethodWriter.cs",
            "startLine": 20,
            "endLine": 26
          }
        ]
      }
    ],
    "unknowns": [],
    "confidence": 1
  },
  "scores": {
    "strictSuccess": true,
    "claimPrecision": 1,
    "claimRecall": 1,
    "claimF1": 1,
    "citationValidity": 1,
    "criticalForbiddenClaims": 0,
    "scorerVersion": "1.1.0"
  },
  "metrics": {
    "turns": 1,
    "toolCalls": 2,
    "nativeToolCalls": 2,
    "sanjayaToolCalls": 0,
    "repositorySourceBytesRead": 49175,
    "toolResponseBytes": 49175,
    "uncachedInputTokens": 15274,
    "cachedInputTokens": 38144,
    "outputTokens": 554,
    "wallTimeMs": 19233,
    "indexWrites": 0
  },
  "trace": {
    "path": "traces/SJ-RUN-2058-D612AEB3.jsonl",
    "sha256": "5bfe5bb1c7e37839ed691532842d49ea02b323151aef3ffd2737141816b93a01",
    "eventCount": 5
  }
}
