{
  "schemaVersion": "1.0",
  "runId": "SJ-RUN-2064-E7F2CBA0",
  "taskId": "SJ-EVAL-0012",
  "arm": "native",
  "repetition": 3,
  "model": {
    "provider": "OpenAI",
    "model": "gpt-5.6-terra",
    "agent": "codex-cli",
    "agentVersion": "0.144.5",
    "effort": "medium"
  },
  "controls": {
    "promptSha256": "c7255bbc2cd77b7dc9ac1a1cb5acf90d48701910388b5222f541af86c43bcd5d",
    "repositoryCommit": "327570c17f4e337ea5ae4574a5fe6abee4a6838b",
    "networkAccess": false,
    "maxTurns": 1,
    "timeoutSeconds": 300
  },
  "status": "completed",
  "answer": {
    "schemaVersion": "1.0",
    "taskId": "SJ-EVAL-0012",
    "answer": "Detached Aspire CLI child processes remove environment variables whose names start with `ASPIRE_EXTENSION_` (case-insensitive). `DEBUG_SESSION_*` variables are not removed; they are kept intact.",
    "claims": [
      {
        "key": "removed_prefix",
        "value": "ASPIRE_EXTENSION_ (matched case-insensitively)",
        "evidence": [
          {
            "path": "src/Aspire.Cli/Commands/AppHostLauncher.cs",
            "startLine": 339,
            "endLine": 353
          },
          {
            "path": "src/Aspire.Cli/Commands/AppHostLauncher.cs",
            "startLine": 387,
            "endLine": 398
          }
        ]
      },
      {
        "key": "debug_session_removed",
        "value": "No. DEBUG_SESSION_* variables are explicitly retained.",
        "evidence": [
          {
            "path": "src/Aspire.Cli/Commands/AppHostLauncher.cs",
            "startLine": 339,
            "endLine": 346
          }
        ]
      }
    ],
    "unknowns": [],
    "confidence": 0.99
  },
  "scores": {
    "strictSuccess": true,
    "claimPrecision": 1,
    "claimRecall": 1,
    "claimF1": 1,
    "citationValidity": 0.6666666666666666,
    "criticalForbiddenClaims": 0,
    "scorerVersion": "1.1.0"
  },
  "metrics": {
    "turns": 1,
    "toolCalls": 4,
    "nativeToolCalls": 4,
    "sanjayaToolCalls": 0,
    "repositorySourceBytesRead": 1071063,
    "toolResponseBytes": 1071063,
    "uncachedInputTokens": 24073,
    "cachedInputTokens": 95488,
    "outputTokens": 834,
    "wallTimeMs": 25534,
    "indexWrites": 0
  },
  "trace": {
    "path": "traces/SJ-RUN-2064-E7F2CBA0.jsonl",
    "sha256": "7993420f2be2103ade9c03a12c2ab78beaa6e57e89898ba79d3d4c29b3ddec78",
    "eventCount": 8
  }
}
