{
  "schemaVersion": "1.0",
  "runId": "SJ-RUN-2071-FA331B3A",
  "taskId": "SJ-EVAL-0008",
  "arm": "native",
  "repetition": 1,
  "model": {
    "provider": "OpenAI",
    "model": "gpt-5.6-terra",
    "agent": "codex-cli",
    "agentVersion": "0.144.5",
    "effort": "medium"
  },
  "controls": {
    "promptSha256": "30a00cff5660743c6aeac7a79a5cbe08efddaee857da712a5b83c2942f409b72",
    "repositoryCommit": "d8b040c63aaffad22aa9921536ae201cff53cc0f",
    "networkAccess": false,
    "maxTurns": 1,
    "timeoutSeconds": 300
  },
  "status": "completed",
  "answer": {
    "schemaVersion": "1.0",
    "taskId": "SJ-EVAL-0008",
    "answer": "The VM worker initiates module-graph prewarming in `runVmTests` by fire-and-forget calling `rpc.prewarmModuleGraph(...)` before VM environment setup. It overlaps server-side module transforms with the worker importing its environment package; rejected prewarm promises are ignored so the worker’s normal fetch reports errors with import context.",
    "claims": [
      {
        "key": "containing_function",
        "value": "`runVmTests` in `packages/vitest/src/runtime/workers/vm.ts`.",
        "evidence": [
          {
            "path": "packages/vitest/src/runtime/workers/vm.ts",
            "startLine": 30,
            "endLine": 35
          },
          {
            "path": "packages/vitest/src/runtime/workers/vm.ts",
            "startLine": 43,
            "endLine": 46
          }
        ]
      },
      {
        "key": "rpc_method",
        "value": "`rpc.prewarmModuleGraph(environment.viteEnvironment || environment.name, ctx.files.map(file => file.filepath))`.",
        "evidence": [
          {
            "path": "packages/vitest/src/runtime/workers/vm.ts",
            "startLine": 43,
            "endLine": 46
          },
          {
            "path": "packages/vitest/src/types/rpc.ts",
            "startLine": 23,
            "endLine": 28
          }
        ]
      },
      {
        "key": "overlapped_work",
        "value": "The server transforms each test file’s import graph while the VM worker imports its environment package, before environment setup; warm transforms allow the worker’s subsequent fetches to short-circuit to disk reads.",
        "evidence": [
          {
            "path": "packages/vitest/src/runtime/workers/vm.ts",
            "startLine": 37,
            "endLine": 42
          },
          {
            "path": "packages/vitest/src/types/rpc.ts",
            "startLine": 23,
            "endLine": 26
          }
        ]
      },
      {
        "key": "failure_policy",
        "value": "Failures are swallowed with `.catch(() => {})`; the worker’s own fetch is responsible for reporting them with the proper import context.",
        "evidence": [
          {
            "path": "packages/vitest/src/runtime/workers/vm.ts",
            "startLine": 41,
            "endLine": 46
          }
        ]
      }
    ],
    "unknowns": [],
    "confidence": 0.99
  },
  "scores": {
    "strictSuccess": false,
    "claimPrecision": 0.5,
    "claimRecall": 0.5,
    "claimF1": 0.5,
    "citationValidity": 0.7142857142857143,
    "criticalForbiddenClaims": 0,
    "scorerVersion": "1.1.0"
  },
  "metrics": {
    "turns": 1,
    "toolCalls": 2,
    "nativeToolCalls": 2,
    "sanjayaToolCalls": 0,
    "repositorySourceBytesRead": 26985,
    "toolResponseBytes": 26985,
    "uncachedInputTokens": 23740,
    "cachedInputTokens": 31232,
    "outputTokens": 790,
    "wallTimeMs": 25283,
    "indexWrites": 0
  },
  "trace": {
    "path": "traces/SJ-RUN-2071-FA331B3A.jsonl",
    "sha256": "5d19bdbecf3c13a570c89aa0b64915b80df7b56fbd6e19d89ee1e84163e62c8b",
    "eventCount": 5
  }
}
