{
  "schemaVersion": "1.0",
  "runId": "SJ-RUN-2011-25E6A49C",
  "taskId": "SJ-EVAL-0007",
  "arm": "evidence_first_skill",
  "repetition": 2,
  "model": {
    "provider": "OpenAI",
    "model": "gpt-5.6-terra",
    "agent": "codex-cli",
    "agentVersion": "0.144.5",
    "effort": "medium"
  },
  "controls": {
    "promptSha256": "9dedf3dd0c14c78ed13866b6b8c2c60eaa9b4ef25623c50e7cc973e9847f4cff",
    "repositoryCommit": "d8b040c63aaffad22aa9921536ae201cff53cc0f",
    "networkAccess": false,
    "maxTurns": 1,
    "timeoutSeconds": 300,
    "pluginManifestSha256": "66b3787a4252d399e92f9de63d0ab62e83d8631d14ca1c18ab80c074144deb93",
    "skillSha256": "53c9d462120bc08d3351d6a24edd4bb8292f9db21409b6a4c5c7b591597d9418"
  },
  "status": "completed",
  "answer": {
    "schemaVersion": "1.0",
    "taskId": "SJ-EVAL-0007",
    "answer": "The worker-wide VM-pool V8 cache is `CodeCache`; cache hits require the module identifier and exact source text, and failed cache-data production stores the source with `data: undefined`.",
    "claims": [
      {
        "key": "cache_class",
        "value": "`CodeCache`",
        "evidence": [
          {
            "path": "packages/vitest/src/runtime/vm/code-cache.ts",
            "startLine": 7,
            "endLine": 18
          }
        ]
      },
      {
        "key": "hit_guard",
        "value": "Module identifier and exact source text (`entry.source === source`).",
        "evidence": [
          {
            "path": "packages/vitest/src/runtime/vm/code-cache.ts",
            "startLine": 14,
            "endLine": 16
          },
          {
            "path": "packages/vitest/src/runtime/vm/code-cache.ts",
            "startLine": 21,
            "endLine": 25
          }
        ]
      },
      {
        "key": "produce_failure",
        "value": "An entry `{ source, data: undefined }` is stored.",
        "evidence": [
          {
            "path": "packages/vitest/src/runtime/vm/code-cache.ts",
            "startLine": 39,
            "endLine": 46
          }
        ]
      }
    ],
    "unknowns": [],
    "confidence": 0.99
  },
  "scores": {
    "strictSuccess": false,
    "claimPrecision": 0.3333333333333333,
    "claimRecall": 0.3333333333333333,
    "claimF1": 0.3333333333333333,
    "citationValidity": 1,
    "criticalForbiddenClaims": 0,
    "scorerVersion": "1.1.0"
  },
  "metrics": {
    "turns": 1,
    "toolCalls": 3,
    "nativeToolCalls": 3,
    "sanjayaToolCalls": 0,
    "repositorySourceBytesRead": 24949,
    "toolResponseBytes": 24949,
    "uncachedInputTokens": 22396,
    "cachedInputTokens": 37120,
    "outputTokens": 891,
    "wallTimeMs": 25604,
    "indexWrites": 0
  },
  "trace": {
    "path": "traces/SJ-RUN-2011-25E6A49C.jsonl",
    "sha256": "ef82a293115e73314d6e1249137004a04fd20dff7d04456d5335a6005f5affb2",
    "eventCount": 6
  }
}
