{
  "schemaVersion": "1.0",
  "runId": "SJ-RUN-1011-A44D9167",
  "taskId": "SJ-EVAL-0009",
  "arm": "sanjaya_guided",
  "repetition": 1,
  "model": {
    "provider": "OpenAI",
    "model": "gpt-5.6-terra",
    "agent": "codex-cli",
    "agentVersion": "0.144.5",
    "effort": "medium"
  },
  "controls": {
    "promptSha256": "fd1824ccee659a1ba12e831d4ce0c7d0e22fa54086f725b564d6663ae9a5e0fc",
    "repositoryCommit": "b9e61265f8394a6c5d0358e89e037873375b017a",
    "networkAccess": false,
    "maxTurns": 1,
    "timeoutSeconds": 300
  },
  "status": "completed",
  "answer": {
    "schemaVersion": "1.0",
    "taskId": "SJ-EVAL-0009",
    "answer": "The TypeScript writer is Kiota.Builder.Writers.TypeScript.CodeMethodWriter. In WriteCodeElement, after writing documentation and the method prototype, it throws InvalidOperationException when the method's parent is a CodeClass, because TypeScript generates no method implementations (only functions or constants).",
    "claims": [
      {
        "key": "writer_type",
        "value": "Kiota.Builder.Writers.TypeScript.CodeMethodWriter",
        "evidence": [
          {
            "path": "src/Kiota.Builder/Writers/TypeScript/CodeMethodWriter.cs",
            "startLine": 9,
            "endLine": 11
          }
        ]
      },
      {
        "key": "class_parent_behavior",
        "value": "When codeElement.Parent is CodeClass, WriteCodeElement throws InvalidOperationException: \"No method implementations are generated in typescript: either functions or constants.\"",
        "evidence": [
          {
            "path": "src/Kiota.Builder/Writers/TypeScript/CodeMethodWriter.cs",
            "startLine": 21,
            "endLine": 27
          }
        ]
      }
    ],
    "unknowns": [],
    "confidence": 1
  },
  "scores": {
    "strictSuccess": false,
    "claimPrecision": 0.5,
    "claimRecall": 0.5,
    "claimF1": 0.5,
    "citationValidity": 1,
    "criticalForbiddenClaims": 0,
    "scorerVersion": "1.0.0"
  },
  "metrics": {
    "turns": 1,
    "toolCalls": 5,
    "nativeToolCalls": 0,
    "sanjayaToolCalls": 5,
    "repositorySourceBytesRead": 99728,
    "toolResponseBytes": 99728,
    "uncachedInputTokens": 21487,
    "cachedInputTokens": 137472,
    "outputTokens": 729,
    "wallTimeMs": 27133
  },
  "trace": {
    "path": "traces/SJ-RUN-1011-A44D9167.jsonl",
    "sha256": "4b6274fe7d709b364d2c984661fde964acf59106ff3349660e7af1d97f1320bd",
    "eventCount": 9
  }
}
