{
  "schemaVersion": "1.0",
  "runId": "SJ-RUN-0056-D10994BF",
  "taskId": "SJ-EVAL-0010",
  "arm": "sanjaya_available",
  "repetition": 3,
  "model": {
    "provider": "OpenAI",
    "model": "gpt-5.6-terra",
    "agent": "codex-cli",
    "agentVersion": "0.144.5",
    "effort": "medium"
  },
  "controls": {
    "promptSha256": "7f7c09b15869d55bc40e116ebc79090f492c78b0ce3953e7da4d3e681ee08e5e",
    "repositoryCommit": "b9e61265f8394a6c5d0358e89e037873375b017a",
    "networkAccess": false,
    "maxTurns": 1,
    "timeoutSeconds": 300
  },
  "status": "completed",
  "answer": {
    "schemaVersion": "1.0",
    "taskId": "SJ-EVAL-0010",
    "answer": "The helper is the default-exported `connectToKiota`. It starts Kiota with `rpc`, returns a new `Error` using `error.data.message` (or a fallback) if its callback throws, and in `finally` disposes the RPC resources, ends stdin, and kills the child process.",
    "claims": [
      {
        "key": "function_name",
        "value": "connectToKiota (default export)",
        "evidence": [
          {
            "path": "vscode/packages/npm-package/lib/connect.ts",
            "startLine": 6,
            "endLine": 6
          }
        ]
      },
      {
        "key": "child_argument",
        "value": "[\"rpc\"]",
        "evidence": [
          {
            "path": "vscode/packages/npm-package/lib/connect.ts",
            "startLine": 9,
            "endLine": 9
          }
        ]
      },
      {
        "key": "callback_error_result",
        "value": "Returns `new Error(errorMessage)`, where `errorMessage` is `error.data.message` or `\"An unknown error occurred\"`.",
        "evidence": [
          {
            "path": "vscode/packages/npm-package/lib/connect.ts",
            "startLine": 23,
            "endLine": 27
          }
        ]
      },
      {
        "key": "child_cleanup",
        "value": "Disposes `inputReader`, `outputWriter`, and `connection`; then ends `childProcess.stdin` and calls `childProcess.kill()`.",
        "evidence": [
          {
            "path": "vscode/packages/npm-package/lib/connect.ts",
            "startLine": 28,
            "endLine": 34
          }
        ]
      }
    ],
    "unknowns": [],
    "confidence": 1
  },
  "scores": {
    "strictSuccess": false,
    "claimPrecision": 0,
    "claimRecall": 0,
    "claimF1": 0,
    "citationValidity": 1,
    "criticalForbiddenClaims": 0,
    "scorerVersion": "1.0.0"
  },
  "metrics": {
    "turns": 1,
    "toolCalls": 2,
    "nativeToolCalls": 2,
    "sanjayaToolCalls": 0,
    "repositorySourceBytesRead": 9545,
    "toolResponseBytes": 9545,
    "uncachedInputTokens": 14111,
    "cachedInputTokens": 22528,
    "outputTokens": 646,
    "wallTimeMs": 17922
  },
  "trace": {
    "path": "traces/SJ-RUN-0056-D10994BF.jsonl",
    "sha256": "13a3586c8f24aba4a7ae5b98190651c6e0f97ac3d726cdb9da96181b04ac6376",
    "eventCount": 5
  }
}
