{
  "schemaVersion": "1.0",
  "runId": "SJ-RUN-2069-F60B5F4D",
  "taskId": "SJ-EVAL-0009",
  "arm": "native",
  "repetition": 1,
  "model": {
    "provider": "OpenAI",
    "model": "gpt-5.6-terra",
    "agent": "codex-cli",
    "agentVersion": "0.144.5",
    "effort": "medium"
  },
  "controls": {
    "promptSha256": "d7b08725f97e30201f76be4003a8594ba5b9528ad102d583612d4ad967856ec4",
    "repositoryCommit": "b9e61265f8394a6c5d0358e89e037873375b017a",
    "networkAccess": false,
    "maxTurns": 1,
    "timeoutSeconds": 300
  },
  "status": "completed",
  "answer": {
    "schemaVersion": "1.0",
    "taskId": "SJ-EVAL-0009",
    "answer": "The TypeScript writer is Kiota.Builder.Writers.TypeScript.CodeMethodWriter. For a CodeClass parent, WriteCodeElement writes the method documentation and prototype, then throws InvalidOperationException because TypeScript generates no method implementations.",
    "claims": [
      {
        "key": "writer_type",
        "value": "Kiota.Builder.Writers.TypeScript.CodeMethodWriter",
        "evidence": [
          {
            "path": "src/Kiota.Builder/Writers/TypeScript/CodeMethodWriter.cs",
            "startLine": 9,
            "endLine": 13
          }
        ]
      },
      {
        "key": "class_parent_behavior",
        "value": "When codeElement.Parent is CodeClass, WriteCodeElement throws InvalidOperationException(\"No method implementations are generated in typescript: either functions or constants.\") after calling WriteMethodDocumentation and WriteMethodPrototype.",
        "evidence": [
          {
            "path": "src/Kiota.Builder/Writers/TypeScript/CodeMethodWriter.cs",
            "startLine": 20,
            "endLine": 27
          }
        ]
      }
    ],
    "unknowns": [],
    "confidence": 1
  },
  "scores": {
    "strictSuccess": true,
    "claimPrecision": 1,
    "claimRecall": 1,
    "claimF1": 1,
    "citationValidity": 1,
    "criticalForbiddenClaims": 0,
    "scorerVersion": "1.1.0"
  },
  "metrics": {
    "turns": 1,
    "toolCalls": 2,
    "nativeToolCalls": 2,
    "sanjayaToolCalls": 0,
    "repositorySourceBytesRead": 18355,
    "toolResponseBytes": 18355,
    "uncachedInputTokens": 8769,
    "cachedInputTokens": 31488,
    "outputTokens": 509,
    "wallTimeMs": 21278,
    "indexWrites": 0
  },
  "trace": {
    "path": "traces/SJ-RUN-2069-F60B5F4D.jsonl",
    "sha256": "e56e116a8c001080204c88901b5a8d2fd32e3ee46fa667a5220f4e42d02f8d42",
    "eventCount": 5
  }
}
