{
  "schemaVersion": "1.0",
  "runId": "SJ-RUN-0032-5FF9CCD3",
  "taskId": "SJ-EVAL-0004",
  "arm": "native",
  "repetition": 3,
  "model": {
    "provider": "OpenAI",
    "model": "gpt-5.6-terra",
    "agent": "codex-cli",
    "agentVersion": "0.144.5",
    "effort": "medium"
  },
  "controls": {
    "promptSha256": "7a432abe81f25f39900bf69960ab19663c037d430d00152a0e5ab54ba1ce6620",
    "repositoryCommit": "c321a020bbb810ade59d63a48210de9fa84f0f52",
    "networkAccess": false,
    "maxTurns": 1,
    "timeoutSeconds": 300
  },
  "status": "completed",
  "answer": {
    "schemaVersion": "1.0",
    "taskId": "SJ-EVAL-0004",
    "answer": "Latest commit: c321a020bbb810ade59d63a48210de9fa84f0f52 — “Align the retry preview default.” Previous commit: 78d0d8290a0300eda1b46569f853de36f65257f4 — “Tune the runtime retry base delay.” Current working tree (not committed): modified docs/operator-runbook.md; untracked local-observation.txt.",
    "claims": [
      {
        "key": "latest_commit",
        "value": "c321a020bbb810ade59d63a48210de9fa84f0f52 — Align the retry preview default; modified frontend/src/app/core/runtime-config.ts.",
        "evidence": [
          {
            "path": "frontend/src/app/core/runtime-config.ts",
            "startLine": 9,
            "endLine": 9
          }
        ]
      },
      {
        "key": "previous_commit",
        "value": "78d0d8290a0300eda1b46569f853de36f65257f4 — Tune the runtime retry base delay; modified config/runtime.json.",
        "evidence": [
          {
            "path": "config/runtime.json",
            "startLine": 3,
            "endLine": 3
          }
        ]
      },
      {
        "key": "modified_path",
        "value": "docs/operator-runbook.md (current working-tree modification; not committed).",
        "evidence": [
          {
            "path": "docs/operator-runbook.md",
            "startLine": 12,
            "endLine": 13
          }
        ]
      },
      {
        "key": "untracked_path",
        "value": "local-observation.txt (current untracked working-tree file; not committed).",
        "evidence": [
          {
            "path": "local-observation.txt",
            "startLine": 1,
            "endLine": 1
          }
        ]
      }
    ],
    "unknowns": [],
    "confidence": 0.99
  },
  "scores": {
    "strictSuccess": false,
    "claimPrecision": 0,
    "claimRecall": 0,
    "claimF1": 0,
    "citationValidity": 0.5,
    "criticalForbiddenClaims": 0,
    "scorerVersion": "1.0.0"
  },
  "metrics": {
    "turns": 1,
    "toolCalls": 3,
    "nativeToolCalls": 3,
    "sanjayaToolCalls": 0,
    "repositorySourceBytesRead": 4537,
    "toolResponseBytes": 4537,
    "uncachedInputTokens": 4714,
    "cachedInputTokens": 42496,
    "outputTokens": 1403,
    "wallTimeMs": 33596
  },
  "trace": {
    "path": "traces/SJ-RUN-0032-5FF9CCD3.jsonl",
    "sha256": "79e0ec5c9f30a329ae1e7eb8bacd8c61bcc51ba0e36b64b1c5ce1eeeb3148ae9",
    "eventCount": 7
  }
}
