{
  "schemaVersion": "1.0",
  "runId": "SJ-RUN-2059-D82DDA13",
  "taskId": "SJ-EVAL-0004",
  "arm": "evidence_first_skill",
  "repetition": 3,
  "model": {
    "provider": "OpenAI",
    "model": "gpt-5.6-terra",
    "agent": "codex-cli",
    "agentVersion": "0.144.5",
    "effort": "medium"
  },
  "controls": {
    "promptSha256": "7a432abe81f25f39900bf69960ab19663c037d430d00152a0e5ab54ba1ce6620",
    "repositoryCommit": "c321a020bbb810ade59d63a48210de9fa84f0f52",
    "networkAccess": false,
    "maxTurns": 1,
    "timeoutSeconds": 300,
    "pluginManifestSha256": "66b3787a4252d399e92f9de63d0ab62e83d8631d14ca1c18ab80c074144deb93",
    "skillSha256": "53c9d462120bc08d3351d6a24edd4bb8292f9db21409b6a4c5c7b591597d9418"
  },
  "status": "completed",
  "answer": {
    "schemaVersion": "1.0",
    "taskId": "SJ-EVAL-0004",
    "answer": "Latest commit: c321a020bbb810ade59d63a48210de9fa84f0f52 — Align the retry preview default (modified frontend/src/app/core/runtime-config.ts). Previous commit: 78d0d8290a0300eda1b46569f853de36f65257f4 — Tune the runtime retry base delay (modified config/runtime.json). Current working tree, not committed: modified docs/operator-runbook.md; untracked local-observation.txt.",
    "claims": [
      {
        "key": "latest_commit",
        "value": "c321a020bbb810ade59d63a48210de9fa84f0f52 — Align the retry preview default; modified frontend/src/app/core/runtime-config.ts.",
        "evidence": [
          {
            "path": "frontend/src/app/core/runtime-config.ts",
            "startLine": 9,
            "endLine": 9
          }
        ]
      },
      {
        "key": "previous_commit",
        "value": "78d0d8290a0300eda1b46569f853de36f65257f4 — Tune the runtime retry base delay; modified config/runtime.json.",
        "evidence": [
          {
            "path": "config/runtime.json",
            "startLine": 3,
            "endLine": 3
          }
        ]
      },
      {
        "key": "modified_path",
        "value": "docs/operator-runbook.md is modified in the current working tree and is not committed.",
        "evidence": [
          {
            "path": "docs/operator-runbook.md",
            "startLine": 13,
            "endLine": 13
          }
        ]
      },
      {
        "key": "untracked_path",
        "value": "local-observation.txt is untracked in the current working tree and is not committed.",
        "evidence": [
          {
            "path": "local-observation.txt",
            "startLine": 1,
            "endLine": 1
          }
        ]
      }
    ],
    "unknowns": [],
    "confidence": 0.99
  },
  "scores": {
    "strictSuccess": false,
    "claimPrecision": 1,
    "claimRecall": 1,
    "claimF1": 1,
    "citationValidity": 0.25,
    "criticalForbiddenClaims": 0,
    "scorerVersion": "1.1.0"
  },
  "metrics": {
    "turns": 1,
    "toolCalls": 3,
    "nativeToolCalls": 3,
    "sanjayaToolCalls": 0,
    "repositorySourceBytesRead": 7947,
    "toolResponseBytes": 7947,
    "uncachedInputTokens": 7836,
    "cachedInputTokens": 44032,
    "outputTokens": 1498,
    "wallTimeMs": 39036,
    "indexWrites": 0
  },
  "trace": {
    "path": "traces/SJ-RUN-2059-D82DDA13.jsonl",
    "sha256": "6a73e363bb6943caf5243b6a0f167a72c426d8cdac98e3b68f80c2dd6e2f7027",
    "eventCount": 6
  }
}
